{
  "schema_version": 1,
  "source_offer_id": "900000000002",
  "status": "completed",
  "items": [
    {
      "source_sku_id": "filter-small",
      "group_id": "main",
      "description_category_id": 17027931,
      "type_id": 94600,
      "name": "Походный фильтр для воды, компактный",
      "attributes": [
        { "id": 85, "complex_id": 0, "values": [{ "dictionary_value_id": 126745801, "value": "无品牌" }], "provenance": "default", "confidence": "high", "evidence": [{ "source": "policy", "field": "attribute.85.default", "value": "无品牌" }] },
        { "id": 4180, "complex_id": 0, "values": [{ "value": "Походный фильтр для воды, компактный" }], "provenance": "derived", "confidence": "high", "evidence": [{ "source": "canonical_v2", "field": "skus.filter-small.specs", "value": "小号" }] },
        { "id": 4191, "complex_id": 0, "values": [{ "value": "Компактный походный фильтр предназначен для очистки воды во время поездок и отдыха на природе." }], "provenance": "derived", "confidence": "high", "evidence": [{ "source": "canonical_v2", "field": "product.attributes", "value": "户外便携净水" }] },
        { "id": 4383, "complex_id": 0, "values": [{ "value": "250" }], "provenance": "converted", "confidence": "high", "evidence": [{ "source": "1688_raw", "field": "package.weight", "value": "0.25 kg" }] },
        { "id": 4389, "complex_id": 0, "values": [{ "dictionary_value_id": 90296, "value": "中国" }], "provenance": "default", "confidence": "high", "evidence": [{ "source": "policy", "field": "attribute.4389.default", "value": "中国" }] },
        { "id": 4497, "complex_id": 0, "values": [{ "value": "300" }], "provenance": "derived", "confidence": "high", "evidence": [{ "source": "policy", "field": "attribute.4497.formula", "value": "250 + 50" }] },
        { "id": 8229, "complex_id": 0, "values": [{ "dictionary_value_id": 94600, "value": "野外过滤器" }], "provenance": "source", "confidence": "high", "evidence": [{ "source": "category_attributes", "field": "attribute.8229", "value": "野外过滤器" }] },
        { "id": 9048, "complex_id": 0, "values": [{ "value": "900000000002" }], "provenance": "derived", "confidence": "high", "evidence": [{ "source": "category_decision", "field": "group_id", "value": "main" }] },
        { "id": 10096, "complex_id": 0, "values": [{ "dictionary_value_id": 369939085, "value": "多色" }], "provenance": "default", "confidence": "high", "evidence": [{ "source": "policy", "field": "attribute.10096.fallback", "value": "多色" }] },
        { "id": 11650, "complex_id": 0, "values": [{ "value": "1" }], "provenance": "default", "confidence": "high", "evidence": [{ "source": "policy", "field": "attribute.11650.fallback", "value": "1" }] },
        { "id": 23171, "complex_id": 0, "values": [{ "value": "#поход #туризм #фильтр_для_воды #чистая_вода #путешествие #кемпинг #природа #активный_отдых #снаряжение #выживание #питьевая_вода #очистка_воды #походная_кухня #рыбалка #охота #дача #пикник #рюкзак #дорога #безопасная_вода" }], "provenance": "derived", "confidence": "high", "evidence": [{ "source": "canonical_v2", "field": "product.title_zh", "value": "户外净水器" }] }
      ]
    },
    {
      "source_sku_id": "filter-large",
      "group_id": "main",
      "description_category_id": 17027931,
      "type_id": 94600,
      "name": "Походный фильтр для воды, большой",
      "attributes": [
        { "id": 85, "complex_id": 0, "values": [{ "dictionary_value_id": 126745801, "value": "无品牌" }], "provenance": "default", "confidence": "high", "evidence": [{ "source": "policy", "field": "attribute.85.default", "value": "无品牌" }] },
        { "id": 4180, "complex_id": 0, "values": [{ "value": "Походный фильтр для воды, большой" }], "provenance": "derived", "confidence": "high", "evidence": [{ "source": "canonical_v2", "field": "skus.filter-large.specs", "value": "大号" }] },
        { "id": 4191, "complex_id": 0, "values": [{ "value": "Большой походный фильтр предназначен для очистки воды во время поездок и отдыха на природе." }], "provenance": "derived", "confidence": "high", "evidence": [{ "source": "canonical_v2", "field": "product.attributes", "value": "户外便携净水" }] },
        { "id": 4383, "complex_id": 0, "values": [{ "value": "400" }], "provenance": "source", "confidence": "high", "evidence": [{ "source": "1688_raw", "field": "package.weight", "value": "400 g" }] },
        { "id": 4389, "complex_id": 0, "values": [{ "dictionary_value_id": 90296, "value": "中国" }], "provenance": "default", "confidence": "high", "evidence": [{ "source": "policy", "field": "attribute.4389.default", "value": "中国" }] },
        { "id": 4497, "complex_id": 0, "values": [{ "value": "450" }], "provenance": "derived", "confidence": "high", "evidence": [{ "source": "policy", "field": "attribute.4497.formula", "value": "400 + 50" }] },
        { "id": 8229, "complex_id": 0, "values": [{ "dictionary_value_id": 94600, "value": "野外过滤器" }], "provenance": "source", "confidence": "high", "evidence": [{ "source": "category_attributes", "field": "attribute.8229", "value": "野外过滤器" }] },
        { "id": 9048, "complex_id": 0, "values": [{ "value": "900000000002" }], "provenance": "derived", "confidence": "high", "evidence": [{ "source": "category_decision", "field": "group_id", "value": "main" }] },
        { "id": 10096, "complex_id": 0, "values": [{ "dictionary_value_id": 369939085, "value": "多色" }], "provenance": "default", "confidence": "high", "evidence": [{ "source": "policy", "field": "attribute.10096.fallback", "value": "多色" }] },
        { "id": 11650, "complex_id": 0, "values": [{ "value": "1" }], "provenance": "default", "confidence": "high", "evidence": [{ "source": "policy", "field": "attribute.11650.fallback", "value": "1" }] },
        { "id": 23171, "complex_id": 0, "values": [{ "value": "#поход #туризм #фильтр_для_воды #чистая_вода #путешествие #кемпинг #природа #активный_отдых #снаряжение #выживание #питьевая_вода #очистка_воды #походная_кухня #рыбалка #охота #дача #пикник #рюкзак #дорога #безопасная_вода" }], "provenance": "derived", "confidence": "high", "evidence": [{ "source": "canonical_v2", "field": "product.title_zh", "value": "户外净水器" }] }
      ]
    }
  ],
  "warnings": [],
  "errors": []
}
